Authors,Author(s) ID,Year,Source title,Link,EID
"McKenzie-Coe A., Bell S., Fernandez-Lima F.","56747984700;55423348700;21734397400;",2018,"Analytical Methods","https://www.scopus.com/inward/record.uri?eid=2-s2.0-85053462430&doi=10.1039%2fc8ay00658j&partnerID=40&md5=7d1912a6ca1b28856f71ed008ac21ade",2-s2.0-85053462430
"Cai L., Xia M.-C., Wang Z., Zhao Y.-B., Li Z., Zhang S., Zhang X.","57192666357;57193650389;56026696600;57195363153;55693835900;35232020500;35108563900;",2017,"Analytical Chemistry","https://www.scopus.com/inward/record.uri?eid=2-s2.0-85027466943&doi=10.1021%2facs.analchem.7b01629&partnerID=40&md5=e7e588395af2008f449db6c1db8249ca",2-s2.0-85027466943
"Castellanos A., Bell S., Fernandez-Lima F.","56404094200;55423348700;21734397400;",2016,"Analytical Methods","https://www.scopus.com/inward/record.uri?eid=2-s2.0-84971425429&doi=10.1039%2fc6ay00096g&partnerID=40&md5=934113ac278f6adfe2723f4613ec3342",2-s2.0-84971425429
"Lindström A.-C., Hoogewerff J., Athens J., Obertova Z., Duncan W., Waddell N., Kieser J.","56199419000;6603651344;55783203500;6506296498;56559449200;14047616900;35563406800;",2015,"Forensic Science International","https://www.scopus.com/inward/record.uri?eid=2-s2.0-84934939196&doi=10.1016%2fj.forsciint.2015.05.021&partnerID=40&md5=f3c675d2816a6a30e7842212c58c48c3",2-s2.0-84934939196
"Weber I.T., Melo A.J.G., Lucena M.A.M., Consoli E.F., Rodrigues M.O., de Sá G.F., Maldaner A.O., Talhavini M., Alves S.","7102280478;55153758900;7005609500;56384449500;10144730100;7004281939;36883383800;6602405849;35516899500;",2014,"Forensic Science International","https://www.scopus.com/inward/record.uri?eid=2-s2.0-84907953876&doi=10.1016%2fj.forsciint.2014.09.001&partnerID=40&md5=2a811203ff9fa730df386e55eb7d7ee2",2-s2.0-84907953876
"Szynkowska M.I., Osingłowska K., Pawlaczyk A., Palińska K., Marcinek M., Rogowski J., Czubak A., Parczewski A.","57193914006;55797459300;24074586700;55797115700;55797199700;7006403424;6602724429;6603939834;",2013,"Przemysl Chemiczny","https://www.scopus.com/inward/record.uri?eid=2-s2.0-84880380578&partnerID=40&md5=47a9c37ee37f0b2fc6b62d9c42f8b030",2-s2.0-84880380578
