Authors,Author(s) ID,Year,Source title,Link,EID
"Donghi M., Mason K., Romolo F.S.","55776762800;57209476616;6508292376;",2019,"Journal of Forensic Sciences","https://www.scopus.com/inward/record.uri?eid=2-s2.0-85067853986&doi=10.1111%2f1556-4029.14110&partnerID=40&md5=7268601aadb874748af79d8ef74d5632",2-s2.0-85067853986
"Maitre M., Horder M., Kirkbride K.P., Gassner A.-L., Weyermann C., Roux C., Beavis A.","57192155063;57113201600;56337473100;24764836500;23978745200;7202017940;7007045269;",2018,"Forensic Science International","https://www.scopus.com/inward/record.uri?eid=2-s2.0-85053786512&doi=10.1016%2fj.forsciint.2018.08.036&partnerID=40&md5=054cbf1d9c1e01f091bc8610a375cf17",2-s2.0-85053786512
"Terry M., Fookes B., Bridge C.M.","57194180231;6603223225;8280539200;",2017,"Forensic Science International","https://www.scopus.com/inward/record.uri?eid=2-s2.0-85019091429&doi=10.1016%2fj.forsciint.2017.04.015&partnerID=40&md5=f327b4b552df177c5de656295df7078d",2-s2.0-85019091429
"Zeichner A.","7005860122;",2017,"Forensic Science International","https://www.scopus.com/inward/record.uri?eid=2-s2.0-85007193569&doi=10.1016%2fj.forsciint.2016.11.016&partnerID=40&md5=9c51f972100c4d3aad9dc373b60b5853",2-s2.0-85007193569
"Taudte R.V., Roux C., Beavis A.","55907909000;7202017940;7007045269;",2017,"Forensic Science International","https://www.scopus.com/inward/record.uri?eid=2-s2.0-85000578295&doi=10.1016%2fj.forsciint.2016.11.027&partnerID=40&md5=7acd51d65604c7aaab064b03b725e43c",2-s2.0-85000578295
"Fambro L.A., Miller E.T., Vandenbos D.D., Dockery C.R.","57189263514;57189268527;57189261324;6602477687;",2016,"Analytical Methods","https://www.scopus.com/inward/record.uri?eid=2-s2.0-84967327853&doi=10.1039%2fc6ay00725b&partnerID=40&md5=ee8976c9897f3a6238f866f646231348",2-s2.0-84967327853
"Hogg S.R., Hunter B.C., Waddell Smith R.","36903162600;49863581100;7006383201;",2016,"Journal of Forensic Sciences","https://www.scopus.com/inward/record.uri?eid=2-s2.0-84956810671&doi=10.1111%2f1556-4029.12881&partnerID=40&md5=ec1f10cabb15107321ef96f465c2e8df",2-s2.0-84956810671
"Destefani C.A., Motta L.C., Costa R.A., Macrino C.J., Bassane J.F.P., Filho J.F.A., Silva E.M., Greco S.J., Carneiro M.T.W.D., Endringer D.C., Romão W.","56086468100;56179616200;56825047100;56179775600;56104812200;56179799700;56179889800;15820645600;35785829700;6504021577;57198083811;",2016,"Microchemical Journal","https://www.scopus.com/inward/record.uri?eid=2-s2.0-84941093749&doi=10.1016%2fj.microc.2015.08.021&partnerID=40&md5=6685306756296e53600f87eca7858b96",2-s2.0-84941093749
"Hannigan T.J., McDermott S.D., Greaney C.M., O'Shaughnessy J., O'Brien C.M.","6602302552;7005399253;56829433800;56829019700;56828738400;",2015,"Forensic Science International","https://www.scopus.com/inward/record.uri?eid=2-s2.0-84941247997&doi=10.1016%2fj.forsciint.2015.08.003&partnerID=40&md5=f47569eb3434977ead3e043e2a83e116",2-s2.0-84941247997
"Taudte R.V., Roux C., Bishop D., Blanes L., Doble P., Beavis A.","55907909000;7202017940;7401913655;8606130700;6603627895;7007045269;",2015,"Analytical Methods","https://www.scopus.com/inward/record.uri?eid=2-s2.0-84940971109&doi=10.1039%2fc5ay00306g&partnerID=40&md5=82cb0894147e5a0abacce520bcb029f3",2-s2.0-84940971109
"Abrego Z., Grijalba N., Unceta N., Maguregui M., Sanchez A., Fernández-Isla A., Goicolea M.A., Barrió R.J.","55062298400;56401022300;6507899948;24537370900;14322502100;55062298500;6602249008;7006546783;",2014,"Analyst","https://www.scopus.com/inward/record.uri?eid=2-s2.0-84908462472&doi=10.1039%2fc4an01051e&partnerID=40&md5=54d740959cf7138f7bbe19269b4ae30c",2-s2.0-84908462472
"Yilmaz D., Turşucu A., Uzunoǧlu Z., Korucu D.","56149584400;55257247100;41462051300;33567855000;",2014,"Radiation Physics and Chemistry","https://www.scopus.com/inward/record.uri?eid=2-s2.0-84899870960&doi=10.1016%2fj.radphyschem.2014.04.012&partnerID=40&md5=e3db4cc4fd1bcc27dfedad4e7132c742",2-s2.0-84899870960
"Taudte R.V., Beavis A., Blanes L., Cole N., Doble P., Roux C.","55907909000;7007045269;8606130700;25123483300;6603627895;7202017940;",2014,"BioMed Research International","https://www.scopus.com/inward/record.uri?eid=2-s2.0-84902132405&doi=10.1155%2f2014%2f965403&partnerID=40&md5=9785e912a2019e957ae5f3e5834a278c",2-s2.0-84902132405
"Szomborg K., Jongekrijg F., Gilchrist E., Webb T., Wood D., Barron L.","55858378900;55178490300;55074774900;55858543200;57198667911;12753795900;",2013,"Forensic Science International","https://www.scopus.com/inward/record.uri?eid=2-s2.0-84884320066&doi=10.1016%2fj.forsciint.2013.08.018&partnerID=40&md5=55af4cb6e59fe32a04a2c9c0aaf463f5",2-s2.0-84884320066
"Chang K.H., Jayaprakash P.T., Yew C.H., Abdullah A.F.L.","55645695400;7004736167;55644072200;55621468900;",2013,"Australian Journal of Forensic Sciences","https://www.scopus.com/inward/record.uri?eid=2-s2.0-84875926381&doi=10.1080%2f00450618.2012.691546&partnerID=40&md5=29fd2f61a8e69b91779c69d0ebf86c3e",2-s2.0-84875926381
"Ditrich H.","6701458279;",2012,"Forensic Science International","https://www.scopus.com/inward/record.uri?eid=2-s2.0-84862646554&doi=10.1016%2fj.forsciint.2012.01.034&partnerID=40&md5=1bfcd549dd0998cf5c9f9b4dbfac4acd",2-s2.0-84862646554
"Rowe W.F.","24455160900;",2012,"Encyclopedia of Forensic Sciences: Second Edition","https://www.scopus.com/inward/record.uri?eid=2-s2.0-85043234646&doi=10.1016%2fB978-0-12-382165-2.00270-1&partnerID=40&md5=5c1e67c212578b4e875eaedb87cf739e",2-s2.0-85043234646
"Dalby O., Butler D., Birkett J.W.","36160383000;57198299952;7004014784;",2010,"Journal of Forensic Sciences","https://www.scopus.com/inward/record.uri?eid=2-s2.0-77954320178&doi=10.1111%2fj.1556-4029.2010.01370.x&partnerID=40&md5=8ed7f76d57e3a1216c821751a8972c1b",2-s2.0-77954320178
"Rijnders M.R., Stamouli A., Bolck A.","35811154900;6602670587;56162937300;",2010,"Journal of Forensic Sciences","https://www.scopus.com/inward/record.uri?eid=2-s2.0-77951120499&doi=10.1111%2fj.1556-4029.2009.01292.x&partnerID=40&md5=a247651167a64c9dc3b00ac9407e0c9f",2-s2.0-77951120499
"Heard B.J.","55952457800;",2008,"Handbook of Firearms and Ballistics: Examining and Interpreting Forensic Evidence: Second Edition","https://www.scopus.com/inward/record.uri?eid=2-s2.0-84889317049&doi=10.1002%2f9780470694589&partnerID=40&md5=894e953107f6c07e8f9f431dd89219cb",2-s2.0-84889317049
"Cruces-Blanco C., Gámiz-Gracia L., García-Campaña A.M.","56089349500;6601966891;7004918727;",2007,"TrAC - Trends in Analytical Chemistry","https://www.scopus.com/inward/record.uri?eid=2-s2.0-33847260323&doi=10.1016%2fj.trac.2006.12.007&partnerID=40&md5=c466df607dc94a0a3d4a34233e2088c6",2-s2.0-33847260323
"Oommen Z., Pierce S.M.","6603044544;13606396600;",2006,"Journal of Forensic Sciences","https://www.scopus.com/inward/record.uri?eid=2-s2.0-33646746625&doi=10.1111%2fj.1556-4029.2006.00107.x&partnerID=40&md5=b46dca8d7bf78262ac34fc565d1b7e09",2-s2.0-33646746625
"Zeichner A., Ehrlich S., Shoshani E., Halicz L.","7005860122;7101930871;56615653900;7003803889;",2006,"Forensic Science International","https://www.scopus.com/inward/record.uri?eid=2-s2.0-33644614697&doi=10.1016%2fj.forsciint.2005.01.020&partnerID=40&md5=ee471d1b348d1804a2876b86fd5b2889",2-s2.0-33644614697
"Bai R.-F., Wan L.-H., Li J.-B.","15753321700;23494276000;56239895100;",2005,"Chinese Journal of Forensic Medicine","https://www.scopus.com/inward/record.uri?eid=2-s2.0-20344374947&partnerID=40&md5=f2dcaae0bf85134de5bff5b811dd8c63",2-s2.0-20344374947
"Bernal Morales E., Revilla Vázquez A.L.","6506275690;55788043300;",2004,"Journal of Chromatography A","https://www.scopus.com/inward/record.uri?eid=2-s2.0-9744261714&doi=10.1016%2fj.chroma.2004.10.083&partnerID=40&md5=05c2a0abec58da8e9e3c88b9de69f84b",2-s2.0-9744261714
"Waghmare N.P., Manna A., Rao M.S., Dohare A.K.","6506794567;57206229191;56316108200;10440211700;",2004,"Z Zagadnien Nauk Sadowych","https://www.scopus.com/inward/record.uri?eid=2-s2.0-29544439366&partnerID=40&md5=bb2c4908ee8d81a8dc6b8360817813d1",2-s2.0-29544439366
"Zeichner A.","7005860122;",2003,"Analytical and Bioanalytical Chemistry","https://www.scopus.com/inward/record.uri?eid=2-s2.0-0141956029&doi=10.1007%2fs00216-003-1994-y&partnerID=40&md5=a6c7f79d64cba45b78e3c1d62f4352c5",2-s2.0-0141956029
"Wilhelm M., Obrist C., Schlatter K.","36879153700;57194684615;6508111016;",2002,"Archiv fur Kriminologie","https://www.scopus.com/inward/record.uri?eid=2-s2.0-0036753465&partnerID=40&md5=4ec44146b7963d3912515b5b46b9cc5d",2-s2.0-0036753465
"Saverio Romolo F., Margot P.","6508292376;7004580112;",2001,"Forensic Science International","https://www.scopus.com/inward/record.uri?eid=2-s2.0-0035876938&doi=10.1016%2fS0379-0738%2800%2900428-X&partnerID=40&md5=e2f36a3e097a0be7c0c29e4addbcf379",2-s2.0-0035876938
"MacCrehan W.A., Patierno E.R., Duewer D.L., Reardon M.R.","7003651944;6504664789;7004083675;7102006860;",2001,"Journal of Forensic Sciences","https://www.scopus.com/inward/record.uri?eid=2-s2.0-0035109841&partnerID=40&md5=c0a85946c9ec75ece798db1cf0f854a8",2-s2.0-0035109841
"Reardon M.R., MacCrehan W.A., Rowe W.F.","7102006860;7003651944;24455160900;",2000,"Journal of Forensic Sciences","https://www.scopus.com/inward/record.uri?eid=2-s2.0-0033739491&partnerID=40&md5=5d9e117edf519fabcb5f036f6138a3c7",2-s2.0-0033739491
"Torre C., Mattutino G.","7005464291;6506493063;",2000,"Journal of Forensic Sciences","https://www.scopus.com/inward/record.uri?eid=2-s2.0-0033937097&partnerID=40&md5=4812a7e3ebca39f6b0aaf291d316640c",2-s2.0-0033937097
"Charpentier B., Desrochers C.","21736308800;6601996936;",2000,"Journal of Forensic Sciences","https://www.scopus.com/inward/record.uri?eid=2-s2.0-0034021847&partnerID=40&md5=23186db8d5e672ca00303e4da9d4bb09",2-s2.0-0034021847
"Garofano L., Capra M., Ferrari F., Bizzaro G.P., Di Tullio D., Dell'Olio M., Ghitti A.","13003629700;7006298574;36883328400;6507667796;6508260289;6603561438;6506793662;",1999,"Forensic Science International","https://www.scopus.com/inward/record.uri?eid=2-s2.0-0033038170&doi=10.1016%2fS0379-0738%2899%2900035-3&partnerID=40&md5=5895cfdc2c630a19689aadb1f2753da1",2-s2.0-0033038170
"Niewöhner L., Wenz H.W.","20135268700;7003936731;",1999,"Journal of Forensic Sciences","https://www.scopus.com/inward/record.uri?eid=2-s2.0-17644431530&partnerID=40&md5=be48e041b74059016885e4a86497303c",2-s2.0-17644431530
"Zeichner A., Schecter B., Brener R.","7005860122;6508313917;7004268632;",1998,"Journal of Forensic Sciences","https://www.scopus.com/inward/record.uri?eid=2-s2.0-0031861138&partnerID=40&md5=5b22f98dd5876a80ea118c5f7c474fb9",2-s2.0-0031861138
"MacCrehan W.A., Smith K.D., Rowe W.F.","7003651944;55568517702;24455160900;",1998,"Journal of Forensic Sciences","https://www.scopus.com/inward/record.uri?eid=2-s2.0-0031929716&partnerID=40&md5=93a31f31c84e13f1c354baf3e24fda0e",2-s2.0-0031929716
"Basu S., Boone Jr. C.E., Denio Jr. D.J., Miazga R.A.","7403656094;36797360700;7801377796;6505569890;",1997,"Journal of Forensic Sciences","https://www.scopus.com/inward/record.uri?eid=2-s2.0-0030742763&partnerID=40&md5=817da3eb2c9b9a21dc20bdf0aed0d50c",2-s2.0-0030742763
"Meng H.-H., Caddy B.","7202278946;7004233264;",1997,"Journal of Forensic Sciences","https://www.scopus.com/inward/record.uri?eid=2-s2.0-0030793488&partnerID=40&md5=915d1f40dd367b065908551af1262b10",2-s2.0-0030793488
"Singer R.L., Davis D., Houck M.M.","57197303032;55463208400;7006244647;",1996,"Journal of Forensic Sciences","https://www.scopus.com/inward/record.uri?eid=2-s2.0-0029931924&partnerID=40&md5=54b6583ec2df8db371fb10ecd30f8fb4",2-s2.0-0029931924
"Brettell T.A., Saferstein R.","6604035747;6603724137;",1995,"Analytical Chemistry","https://www.scopus.com/inward/record.uri?eid=2-s2.0-0029644960&doi=10.1021%2fac00108a014&partnerID=40&md5=cdf2374ef14551f9980971d4ffe5c15a",2-s2.0-0029644960
