Authors,Author(s) ID,Year,Source title,Link,EID
"Goudsmits E., Blakey L.S., Chana K., Sharples G.P., Birkett J.W.","56926734200;57200181669;35809803800;7003677879;7004014784;",2019,"Forensic Science International","https://www.scopus.com/inward/record.uri?eid=2-s2.0-85064897555&doi=10.1016%2fj.forsciint.2019.03.049&partnerID=40&md5=5df6475ce883f624b8afe58357ca6870",2-s2.0-85064897555
"Gherghel S., Morgan R.M., Arrebola-Liébanas J., Romero-González R., Blackman C.S., Garrido-Frenich A., Parkin I.P.","57191974296;57194780985;6603727776;15030309800;7005826606;55664491700;57203254267;",2018,"Forensic Science International","https://www.scopus.com/inward/record.uri?eid=2-s2.0-85050806314&doi=10.1016%2fj.forsciint.2018.07.015&partnerID=40&md5=6249791f8f07d99a6ba5a0b976fda958",2-s2.0-85050806314
"Williamson R., Gura S., Tarifa A., Almirall J.R.","57188816394;6603308646;55693603000;7004960911;",2018,"Forensic Chemistry","https://www.scopus.com/inward/record.uri?eid=2-s2.0-85041995766&doi=10.1016%2fj.forc.2018.01.005&partnerID=40&md5=ae519c49df7aac85adc13e85db70db73",2-s2.0-85041995766
"Kara İ.","56592181100;",2018,"Bulgarian Chemical Communications","https://www.scopus.com/inward/record.uri?eid=2-s2.0-85055718544&partnerID=40&md5=7c7f6db967ab193df8177d0b1bbcb6f9",2-s2.0-85055718544
"Fedick P.W., Bain R.M.","55855088100;56452606200;",2017,"Forensic Chemistry","https://www.scopus.com/inward/record.uri?eid=2-s2.0-85021396000&doi=10.1016%2fj.forc.2017.06.005&partnerID=40&md5=42e13ffcae400e33748a1e9f2d8ac1d4",2-s2.0-85021396000
"Reese K.L., Jones A.D., Smith R.W.","25122031100;7407105218;7006383201;",2017,"Forensic Science International","https://www.scopus.com/inward/record.uri?eid=2-s2.0-85009070474&doi=10.1016%2fj.forsciint.2016.12.021&partnerID=40&md5=f9dc3cf9895225f1f5173e1042fcf46a",2-s2.0-85009070474
"Qin Z.-K., Yang F.-Y., Liu W.-B., Zou Y., Yan Y., Wang C.-L., Cai N.-B.","57193357464;57189646980;57191498444;57189639141;57193355515;57193357846;57204283381;",2017,"Guang Pu Xue Yu Guang Pu Fen Xi/Spectroscopy and Spectral Analysis","https://www.scopus.com/inward/record.uri?eid=2-s2.0-85013250191&doi=10.3964%2fj.issn.1000-0593%282017%2901-0114-06&partnerID=40&md5=300bd358498029579e8874e24b9318b5",2-s2.0-85013250191
"Goudsmits E., Sharples G.P., Birkett J.W.","56926734200;7003677879;7004014784;",2016,"Science and Justice","https://www.scopus.com/inward/record.uri?eid=2-s2.0-84979695911&doi=10.1016%2fj.scijus.2016.06.007&partnerID=40&md5=fc48d30e8e1ee29b4dea7eddc4354c17",2-s2.0-84979695911
"Stevens B., Bell S., Adams K.","57192428499;55423348700;57192436419;",2016,"Forensic Chemistry","https://www.scopus.com/inward/record.uri?eid=2-s2.0-85006341534&doi=10.1016%2fj.forc.2016.10.001&partnerID=40&md5=6988527a18b3d9d63a999b9984f711c5",2-s2.0-85006341534
"Li F., Tice J., Musselman B.D., Hall A.B.","57191248516;25958770300;6701338758;54890487000;",2016,"Science and Justice","https://www.scopus.com/inward/record.uri?eid=2-s2.0-84992608951&doi=10.1016%2fj.scijus.2016.06.001&partnerID=40&md5=6124ed79d909909303bc3869372de47b",2-s2.0-84992608951
"Taudte R.V., Roux C., Blanes L., Horder M., Kirkbride K.P., Beavis A.","55907909000;7202017940;8606130700;57113201600;56337473100;7007045269;",2016,"Analytical and Bioanalytical Chemistry","https://www.scopus.com/inward/record.uri?eid=2-s2.0-84958012371&doi=10.1007%2fs00216-016-9357-7&partnerID=40&md5=c88f8ff1eaf8749801be5bd996300fda",2-s2.0-84958012371
"Goudsmits E., Sharples G.P., Birkett J.W.","56926734200;7003677879;7004014784;",2015,"TrAC - Trends in Analytical Chemistry","https://www.scopus.com/inward/record.uri?eid=2-s2.0-84945358419&doi=10.1016%2fj.trac.2015.05.010&partnerID=40&md5=3d1326cf71a2936b306b5cf19a20fca5",2-s2.0-84945358419
"Martin D., Gonzalvez A.G., Buesing F., Urena A.G.","56468440500;35334205500;57041352900;6508242555;",2015,"Applied Spectroscopy","https://www.scopus.com/inward/record.uri?eid=2-s2.0-84953382482&doi=10.1366%2f14-07832&partnerID=40&md5=b206332aa40ff393509000fd7d60826c",2-s2.0-84953382482
"Chang K.H., Jayaprakash P.T., Abdullah A.F.L.","55645695400;7004736167;55621468900;",2015,"Australian Journal of Forensic Sciences","https://www.scopus.com/inward/record.uri?eid=2-s2.0-84926407681&doi=10.1080%2f00450618.2014.907825&partnerID=40&md5=805f7a3f947fe857e2f73e0c5b52ea49",2-s2.0-84926407681
"Chang K.H., Yew C.H., Abdullah A.F.L.","55645695400;55644072200;55621468900;",2015,"Journal of Forensic Sciences","https://www.scopus.com/inward/record.uri?eid=2-s2.0-84938213278&doi=10.1111%2f1556-4029.12745&partnerID=40&md5=7ff573a69e45f6f1c4491cd762f241bf",2-s2.0-84938213278
"Tarifa A., Almirall J.R.","55693603000;7004960911;",2015,"Science and Justice","https://www.scopus.com/inward/record.uri?eid=2-s2.0-84928430302&doi=10.1016%2fj.scijus.2015.02.003&partnerID=40&md5=5f1ff3b752e33b029c8bdca6997e4473",2-s2.0-84928430302
"Abrego Z., Grijalba N., Unceta N., Maguregui M., Sanchez A., Fernández-Isla A., Goicolea M.A., Barrió R.J.","55062298400;56401022300;6507899948;24537370900;14322502100;55062298500;6602249008;7006546783;",2014,"Analyst","https://www.scopus.com/inward/record.uri?eid=2-s2.0-84908462472&doi=10.1039%2fc4an01051e&partnerID=40&md5=54d740959cf7138f7bbe19269b4ae30c",2-s2.0-84908462472
"Wu H., Tian H., Chen M.-F., You J.-C., Du L.-M., Fu Y.-L.","56317119800;55694624300;56316444500;56316652800;7201905794;7404433230;",2014,"Journal of Agricultural and Food Chemistry","https://www.scopus.com/inward/record.uri?eid=2-s2.0-84905750494&doi=10.1021%2fjf502364x&partnerID=40&md5=6f73634d4986f27afdcf85903346926d",2-s2.0-84905750494
"Moran J.W., Bell S.","55480621300;55423348700;",2014,"Analytical Chemistry","https://www.scopus.com/inward/record.uri?eid=2-s2.0-84902805870&doi=10.1021%2fac501227e&partnerID=40&md5=d17e1a191b568108102ba44c34198012",2-s2.0-84902805870
"Dutta S., Das A.K.","9735612900;7403597186;",2014,"Journal of the Indian Chemical Society","https://www.scopus.com/inward/record.uri?eid=2-s2.0-85063082452&partnerID=40&md5=031173186a71dfbc591c2d891e4d447f",2-s2.0-85063082452
"Chang K.H., Yew C.H., Abdullah A.F.L.","55645695400;55644072200;55621468900;",2014,"Journal of Forensic Sciences","https://www.scopus.com/inward/record.uri?eid=2-s2.0-84903435835&doi=10.1111%2f1556-4029.12440&partnerID=40&md5=39f76d2b2723763fa44f890a6c0e6c69",2-s2.0-84903435835
"Taudte R.V., Beavis A., Blanes L., Cole N., Doble P., Roux C.","55907909000;7007045269;8606130700;25123483300;6603627895;7202017940;",2014,"BioMed Research International","https://www.scopus.com/inward/record.uri?eid=2-s2.0-84902132405&doi=10.1155%2f2014%2f965403&partnerID=40&md5=9785e912a2019e957ae5f3e5834a278c",2-s2.0-84902132405
"Chang K.H., Jayaprakash P.T., Yew C.H., Abdullah A.F.L.","55645695400;7004736167;55644072200;55621468900;",2013,"Australian Journal of Forensic Sciences","https://www.scopus.com/inward/record.uri?eid=2-s2.0-84875926381&doi=10.1080%2f00450618.2012.691546&partnerID=40&md5=29fd2f61a8e69b91779c69d0ebf86c3e",2-s2.0-84875926381
"Kabir A., Holness H., Furton K.G., Almirall J.R.","7005744830;55347017000;7004543580;7004960911;",2013,"TrAC - Trends in Analytical Chemistry","https://www.scopus.com/inward/record.uri?eid=2-s2.0-84875549460&doi=10.1016%2fj.trac.2012.11.013&partnerID=40&md5=04041eabfc9ffc6ca3496f1d997543d7",2-s2.0-84875549460
"Kabir A., Holness H., Furton K.G., Almirall J.R.","7005744830;55347017000;7004543580;7004960911;",2012,"Comprehensive Sampling and Sample Preparation","https://www.scopus.com/inward/record.uri?eid=2-s2.0-84884031035&doi=10.1016%2fB978-0-12-381373-2.00003-X&partnerID=40&md5=9b8a01e397116df808db92b160d58f12",2-s2.0-84884031035
"Arndt J., Bell S., Crookshanks L., Lovejoy M., Oleska C., Tulley T., Wolfe D.","54988914800;55423348700;55240223400;55240065900;55240223500;55240005800;55240479600;",2012,"Forensic Science International","https://www.scopus.com/inward/record.uri?eid=2-s2.0-84865615557&doi=10.1016%2fj.forsciint.2012.05.011&partnerID=40&md5=64f9e6fd17f9f6c3b91cd31351dd60a9",2-s2.0-84865615557
"López-López M., Delgado J.J., García-Ruiz C.","36614422500;57198051366;35271820400;",2012,"Analytical Chemistry","https://www.scopus.com/inward/record.uri?eid=2-s2.0-84859915571&doi=10.1021%2fac203237w&partnerID=40&md5=b0e512f42982a17eab58e78eeffdafe4",2-s2.0-84859915571
"Wu Q., Liu M., Ma X., Wang W., Wang C., Zang X., Wang Z.","14029488700;57198348228;36612027000;54409770900;10043151900;10045562700;55719859300;",2012,"Microchimica Acta","https://www.scopus.com/inward/record.uri?eid=2-s2.0-84858342288&doi=10.1007%2fs00604-011-0752-7&partnerID=40&md5=3803174dc91b55282afd92b96d76f68b",2-s2.0-84858342288
"Yücel A., Inal E.K., Akay M.A., Atakol O., ÖZ S.","55152793400;55155260400;7102443023;7005181405;16302263500;",2011,"Central European Journal of Energetic Materials","https://www.scopus.com/inward/record.uri?eid=2-s2.0-84859147610&partnerID=40&md5=52312ed7d400b5066f3ee2dd6fa872e5",2-s2.0-84859147610
"Brettell T.A., Butler J.M., Almirall J.R.","6604035747;7403925483;7004960911;",2011,"Analytical Chemistry","https://www.scopus.com/inward/record.uri?eid=2-s2.0-79959207473&doi=10.1021%2fac201075e&partnerID=40&md5=b8055cc1da139c8bb6960eea5eba1db0",2-s2.0-79959207473
