Authors,Author(s) ID,Year,Source title,Link,EID
"Lucena M.A.M., Arouca A.M., Talhavini M., Alves-Júnior S., Weber I.T.","7005609500;55171878200;6602405849;55880350800;7102280478;",2019,"Microchemical Journal","https://www.scopus.com/inward/record.uri?eid=2-s2.0-85056738396&doi=10.1016%2fj.microc.2018.09.013&partnerID=40&md5=e048b298e9bb5270e3c4862bef852c5e",2-s2.0-85056738396
"Albino de Carvalho M., Talhavini M., Pimentel M.F., Amigo J.M., Pasquini C., Junior S.A., Weber I.T.","57204157323;6602405849;7006799228;13408911100;35507950000;55153735000;7102280478;",2018,"Analytical Methods","https://www.scopus.com/inward/record.uri?eid=2-s2.0-85054748435&doi=10.1039%2fc8ay01341a&partnerID=40&md5=3b479b2931da1c01263cb9718a84e71e",2-s2.0-85054748435
"Filho E.V., de Sousa Filho P.C., Serra O.A., Weber I.T., Lucena M.A.M., Luz P.P.","57202219925;22952643700;7006385764;7102280478;7005609500;57196557625;",2018,"Journal of Luminescence","https://www.scopus.com/inward/record.uri?eid=2-s2.0-85047460130&doi=10.1016%2fj.jlumin.2018.05.012&partnerID=40&md5=c93075743d2e3e91d62f6e460c351002",2-s2.0-85047460130
"Serwy I.B., Wanderley K.A., Lucena M.A.M., Maldaner A.O., Talhavini M., Rodrigues M.O., Weber I.T.","57201520698;37100627500;7005609500;36883383800;6602405849;10144730100;7102280478;",2018,"Journal of Luminescence","https://www.scopus.com/inward/record.uri?eid=2-s2.0-85045191649&doi=10.1016%2fj.jlumin.2018.02.039&partnerID=40&md5=05ce531736118fa03822662017184001",2-s2.0-85045191649
"Arouca A.M., Lucena M.A.M., Rossiter R.J., Talhavini M., Weber I.T.","55171878200;7005609500;57197704853;6602405849;7102280478;",2017,"Forensic Science International","https://www.scopus.com/inward/record.uri?eid=2-s2.0-85034049932&doi=10.1016%2fj.forsciint.2017.09.022&partnerID=40&md5=2d36bf7fdda35cb457cfec2bb0e1c8d6",2-s2.0-85034049932
"Bünzli J.-C.G.","8505785800;",2017,"European Journal of Inorganic Chemistry","https://www.scopus.com/inward/record.uri?eid=2-s2.0-85033473843&doi=10.1002%2fejic.201701201&partnerID=40&md5=01293515543aaf96ee1c0cd00ab6a157",2-s2.0-85033473843
"Lucena M.A.M., Ordoñez C., Weber I.T., Torre M., García-Ruiz C., López-López M.","7005609500;57195937657;7102280478;57195255426;35271820400;36614422500;",2017,"Forensic Science International","https://www.scopus.com/inward/record.uri?eid=2-s2.0-85030236458&doi=10.1016%2fj.forsciint.2017.09.013&partnerID=40&md5=f17878a88133b329baa095e8536daf15",2-s2.0-85030236458
"Mauricio F.G.M., Pralon A.Z., Talhavini M., Rodrigues M.O., Weber I.T.","57193544455;57193550201;6602405849;10144730100;7102280478;",2017,"Forensic Science International","https://www.scopus.com/inward/record.uri?eid=2-s2.0-85014771454&doi=10.1016%2fj.forsciint.2017.02.029&partnerID=40&md5=f3b19bda5a73160e2a6810a66a9bbdbc",2-s2.0-85014771454
"Lucena M.A.M., Oliveira M.F.L., Arouca A.M., Talhavini M., Ferreira E.A., Alves S., Veiga-Souza F.H., Weber I.T.","7005609500;57193237482;55171878200;6602405849;36631865100;35516899500;57193239850;7102280478;",2017,"ACS Applied Materials and Interfaces","https://www.scopus.com/inward/record.uri?eid=2-s2.0-85011965267&doi=10.1021%2facsami.6b13474&partnerID=40&md5=bb06e58ef27ae0ba639470a0e9c6edfd",2-s2.0-85011965267
"Sarraguça J.M.G., Lima C., Machado F., Lopes J.A., Almeida A., Fernandes L., Magalhães T., Santos A.","7801489054;7103053554;57206331494;7202733600;22984051100;7103334942;24473164700;16246477100;",2016,"Analyst","https://www.scopus.com/inward/record.uri?eid=2-s2.0-84978080615&doi=10.1039%2fc6an00247a&partnerID=40&md5=e4b8bd248322783e93e0b0f73443740e",2-s2.0-84978080615
"Melo Lucena M.A., Rodrigues M.O., Gatto C.C., Talhavini M., Maldaner A.O., Alves S., Jr., Weber I.T.","56641614000;10144730100;7003710701;6602405849;36883383800;35516899500;7102280478;",2016,"Journal of Luminescence","https://www.scopus.com/inward/record.uri?eid=2-s2.0-84954390953&doi=10.1016%2fj.jlumin.2015.04.010&partnerID=40&md5=74ada0bde4b221530a41cd5d80be3ffb",2-s2.0-84954390953
"Kumar M., Gupta S.K., Kadam R.M.","55456371400;55495163100;8320788200;",2016,"Materials Research Bulletin","https://www.scopus.com/inward/record.uri?eid=2-s2.0-84945925043&doi=10.1016%2fj.materresbull.2015.10.029&partnerID=40&md5=291b4500f4b255f0191837166ef9098c",2-s2.0-84945925043
"Destefani C.A., Motta L.C., Costa R.A., Macrino C.J., Bassane J.F.P., Filho J.F.A., Silva E.M., Greco S.J., Carneiro M.T.W.D., Endringer D.C., Romão W.","56086468100;56179616200;56825047100;56179775600;56104812200;56179799700;56179889800;15820645600;35785829700;6504021577;57198083811;",2016,"Microchemical Journal","https://www.scopus.com/inward/record.uri?eid=2-s2.0-84941093749&doi=10.1016%2fj.microc.2015.08.021&partnerID=40&md5=6685306756296e53600f87eca7858b96",2-s2.0-84941093749
"Li H., Liu G., Wang J., Dong X., Yu W.","57190570634;35206255700;8215096400;7401797195;39062597400;",2016,"Physical Chemistry Chemical Physics","https://www.scopus.com/inward/record.uri?eid=2-s2.0-84981218261&doi=10.1039%2fc6cp03743g&partnerID=40&md5=51a224603ebc0888729dd5a527bdc5d6",2-s2.0-84981218261
"Goudsmits E., Sharples G.P., Birkett J.W.","56926734200;7003677879;7004014784;",2015,"TrAC - Trends in Analytical Chemistry","https://www.scopus.com/inward/record.uri?eid=2-s2.0-84945358419&doi=10.1016%2fj.trac.2015.05.010&partnerID=40&md5=3d1326cf71a2936b306b5cf19a20fca5",2-s2.0-84945358419
"Grzyb T., Wiglusz R.J., Gruszeczka A., Lis S.","25521912400;27468070000;55390609900;8957233800;",2014,"Dalton Transactions","https://www.scopus.com/inward/record.uri?eid=2-s2.0-84908650649&doi=10.1039%2fc4dt02234c&partnerID=40&md5=7ef700efec4eaa33baac3f27d41d8d2e",2-s2.0-84908650649
"Weber I.T., Melo A.J.G., Lucena M.A.M., Consoli E.F., Rodrigues M.O., de Sá G.F., Maldaner A.O., Talhavini M., Alves S.","7102280478;55153758900;7005609500;56384449500;10144730100;7004281939;36883383800;6602405849;35516899500;",2014,"Forensic Science International","https://www.scopus.com/inward/record.uri?eid=2-s2.0-84907953876&doi=10.1016%2fj.forsciint.2014.09.001&partnerID=40&md5=2a811203ff9fa730df386e55eb7d7ee2",2-s2.0-84907953876
"Abrego Z., Grijalba N., Unceta N., Maguregui M., Sanchez A., Fernández-Isla A., Goicolea M.A., Barrió R.J.","55062298400;56401022300;6507899948;24537370900;14322502100;55062298500;6602249008;7006546783;",2014,"Analyst","https://www.scopus.com/inward/record.uri?eid=2-s2.0-84908462472&doi=10.1039%2fc4an01051e&partnerID=40&md5=54d740959cf7138f7bbe19269b4ae30c",2-s2.0-84908462472
