Authors,Author(s) ID,Year,Source title,Link,EID
"Lucas N., Seyfang K.E., Plummer A., Cook M., Kirkbride K.P., Kobus H.","57169935900;56957040600;57204518307;57169595000;56337473100;7003432475;",2019,"Forensic Science International","https://www.scopus.com/inward/record.uri?eid=2-s2.0-85061693462&doi=10.1016%2fj.forsciint.2019.01.030&partnerID=40&md5=85a87a19d6c935d1de5e29f1e0613f16",2-s2.0-85061693462
"Nguyen C.T.T., Wasson R.J., Estrada E.S., Cantarero S.I., Teo C., Ziegler A.D.","57205265380;7003639138;56646024100;57190139019;57205263124;7201554889;",2019,"Journal of Environmental Management","https://www.scopus.com/inward/record.uri?eid=2-s2.0-85059316894&doi=10.1016%2fj.jenvman.2018.11.106&partnerID=40&md5=cb06c643803423ed43f1a6ae750e4118",2-s2.0-85059316894
"Donghi M., Mason K., Romolo F.S.","55776762800;57209476616;6508292376;",2019,"Journal of Forensic Sciences","https://www.scopus.com/inward/record.uri?eid=2-s2.0-85067853986&doi=10.1111%2f1556-4029.14110&partnerID=40&md5=7268601aadb874748af79d8ef74d5632",2-s2.0-85067853986
"Maitre M., Horder M., Kirkbride K.P., Gassner A.-L., Weyermann C., Roux C., Beavis A.","57192155063;57113201600;56337473100;24764836500;23978745200;7202017940;7007045269;",2018,"Forensic Science International","https://www.scopus.com/inward/record.uri?eid=2-s2.0-85053786512&doi=10.1016%2fj.forsciint.2018.08.036&partnerID=40&md5=054cbf1d9c1e01f091bc8610a375cf17",2-s2.0-85053786512
"Israelsohn-Azulay O., Zidon Y., Tsach T.","25932268300;6507978407;6508141599;",2018,"Forensic Science International","https://www.scopus.com/inward/record.uri?eid=2-s2.0-85045739084&doi=10.1016%2fj.forsciint.2018.02.027&partnerID=40&md5=ce7b3b174fbdd8dd300d21cc087ff16d",2-s2.0-85045739084
"Terry M., Fookes B., Bridge C.M.","57194180231;6603223225;8280539200;",2017,"Forensic Science International","https://www.scopus.com/inward/record.uri?eid=2-s2.0-85019091429&doi=10.1016%2fj.forsciint.2017.04.015&partnerID=40&md5=f327b4b552df177c5de656295df7078d",2-s2.0-85019091429
"Romolo F.S., Stamouli A., Romeo M., Cook M., Orsenigo S., Donghi M.","6508292376;6602670587;57208587788;57169595000;57207987601;55776762800;",2017,"Forensic Chemistry","https://www.scopus.com/inward/record.uri?eid=2-s2.0-85015376565&doi=10.1016%2fj.forc.2017.02.005&partnerID=40&md5=95e812680e189f780979485afdcc0487",2-s2.0-85015376565
"Zeichner A.","7005860122;",2017,"Forensic Science International","https://www.scopus.com/inward/record.uri?eid=2-s2.0-85007193569&doi=10.1016%2fj.forsciint.2016.11.016&partnerID=40&md5=9c51f972100c4d3aad9dc373b60b5853",2-s2.0-85007193569
"Maitre M., Kirkbride K.P., Horder M., Roux C., Beavis A.","57192155063;56337473100;57113201600;7202017940;7007045269;",2017,"Forensic Science International","https://www.scopus.com/inward/record.uri?eid=2-s2.0-84998656243&doi=10.1016%2fj.forsciint.2016.09.003&partnerID=40&md5=72e08daa40fe2a6dc2975729496feac9",2-s2.0-84998656243
"Hogg S.R., Hunter B.C., Waddell Smith R.","36903162600;49863581100;7006383201;",2016,"Journal of Forensic Sciences","https://www.scopus.com/inward/record.uri?eid=2-s2.0-84956810671&doi=10.1111%2f1556-4029.12881&partnerID=40&md5=ec1f10cabb15107321ef96f465c2e8df",2-s2.0-84956810671
"Taudte R.V., Roux C., Bishop D., Blanes L., Doble P., Beavis A.","55907909000;7202017940;7401913655;8606130700;6603627895;7007045269;",2015,"Analytical Methods","https://www.scopus.com/inward/record.uri?eid=2-s2.0-84940971109&doi=10.1039%2fc5ay00306g&partnerID=40&md5=82cb0894147e5a0abacce520bcb029f3",2-s2.0-84940971109
"Abrego Z., Grijalba N., Unceta N., Maguregui M., Sanchez A., Fernández-Isla A., Goicolea M.A., Barrió R.J.","55062298400;56401022300;6507899948;24537370900;14322502100;55062298500;6602249008;7006546783;",2014,"Analyst","https://www.scopus.com/inward/record.uri?eid=2-s2.0-84908462472&doi=10.1039%2fc4an01051e&partnerID=40&md5=54d740959cf7138f7bbe19269b4ae30c",2-s2.0-84908462472
"Taudte R.V., Beavis A., Blanes L., Cole N., Doble P., Roux C.","55907909000;7007045269;8606130700;25123483300;6603627895;7202017940;",2014,"BioMed Research International","https://www.scopus.com/inward/record.uri?eid=2-s2.0-84902132405&doi=10.1155%2f2014%2f965403&partnerID=40&md5=9785e912a2019e957ae5f3e5834a278c",2-s2.0-84902132405
"Romolo F.S., Christopher M.E., Donghi M., Ripani L., Jeynes C., Webb R.P., Ward N.I., Kirkby K.J., Bailey M.J.","6508292376;54782309500;55776762800;6603303870;7005965730;7403006881;16192268900;8683196800;26640197300;",2013,"Forensic Science International","https://www.scopus.com/inward/record.uri?eid=2-s2.0-84879488230&doi=10.1016%2fj.forsciint.2013.05.006&partnerID=40&md5=e07b51cd6937c097051befa58c24150f",2-s2.0-84879488230
"Chang K.H., Jayaprakash P.T., Yew C.H., Abdullah A.F.L.","55645695400;7004736167;55644072200;55621468900;",2013,"Australian Journal of Forensic Sciences","https://www.scopus.com/inward/record.uri?eid=2-s2.0-84875926381&doi=10.1080%2f00450618.2012.691546&partnerID=40&md5=29fd2f61a8e69b91779c69d0ebf86c3e",2-s2.0-84875926381
"Rowe W.F.","24455160900;",2012,"Encyclopedia of Forensic Sciences: Second Edition","https://www.scopus.com/inward/record.uri?eid=2-s2.0-85043234646&doi=10.1016%2fB978-0-12-382165-2.00270-1&partnerID=40&md5=5c1e67c212578b4e875eaedb87cf739e",2-s2.0-85043234646
"Charles S., Nys B., Geusens N.","57197281468;35080922200;34978537600;",2011,"Forensic Science International","https://www.scopus.com/inward/record.uri?eid=2-s2.0-80955177082&doi=10.1016%2fj.forsciint.2011.05.001&partnerID=40&md5=7df89382350f9010ce36ddc325aea1b9",2-s2.0-80955177082
"Dalby O., Butler D., Birkett J.W.","36160383000;57198299952;7004014784;",2010,"Journal of Forensic Sciences","https://www.scopus.com/inward/record.uri?eid=2-s2.0-77954320178&doi=10.1111%2fj.1556-4029.2010.01370.x&partnerID=40&md5=8ed7f76d57e3a1216c821751a8972c1b",2-s2.0-77954320178
"Rijnders M.R., Stamouli A., Bolck A.","35811154900;6602670587;56162937300;",2010,"Journal of Forensic Sciences","https://www.scopus.com/inward/record.uri?eid=2-s2.0-77951120499&doi=10.1111%2fj.1556-4029.2009.01292.x&partnerID=40&md5=a247651167a64c9dc3b00ac9407e0c9f",2-s2.0-77951120499
"Oommen Z., Pierce S.M.","6603044544;13606396600;",2006,"Journal of Forensic Sciences","https://www.scopus.com/inward/record.uri?eid=2-s2.0-33646746625&doi=10.1111%2fj.1556-4029.2006.00107.x&partnerID=40&md5=b46dca8d7bf78262ac34fc565d1b7e09",2-s2.0-33646746625
"Zeichner A., Ehrlich S., Shoshani E., Halicz L.","7005860122;7101930871;56615653900;7003803889;",2006,"Forensic Science International","https://www.scopus.com/inward/record.uri?eid=2-s2.0-33644614697&doi=10.1016%2fj.forsciint.2005.01.020&partnerID=40&md5=ee471d1b348d1804a2876b86fd5b2889",2-s2.0-33644614697
"Zeichner A.","7005860122;",2003,"Analytical and Bioanalytical Chemistry","https://www.scopus.com/inward/record.uri?eid=2-s2.0-0141956029&doi=10.1007%2fs00216-003-1994-y&partnerID=40&md5=a6c7f79d64cba45b78e3c1d62f4352c5",2-s2.0-0141956029
"Northrop D.M.","7006139649;",2001,"Journal of Forensic Sciences","https://www.scopus.com/inward/record.uri?eid=2-s2.0-0034994264&partnerID=40&md5=9c8246a63fbc2c2067265f3f009abff5",2-s2.0-0034994264
"Saverio Romolo F., Margot P.","6508292376;7004580112;",2001,"Forensic Science International","https://www.scopus.com/inward/record.uri?eid=2-s2.0-0035876938&doi=10.1016%2fS0379-0738%2800%2900428-X&partnerID=40&md5=e2f36a3e097a0be7c0c29e4addbcf379",2-s2.0-0035876938
"MacCrehan W.A., Patierno E.R., Duewer D.L., Reardon M.R.","7003651944;6504664789;7004083675;7102006860;",2001,"Journal of Forensic Sciences","https://www.scopus.com/inward/record.uri?eid=2-s2.0-0035109841&partnerID=40&md5=c0a85946c9ec75ece798db1cf0f854a8",2-s2.0-0035109841
"Reardon M.R., MacCrehan W.A., Rowe W.F.","7102006860;7003651944;24455160900;",2000,"Journal of Forensic Sciences","https://www.scopus.com/inward/record.uri?eid=2-s2.0-0033739491&partnerID=40&md5=5d9e117edf519fabcb5f036f6138a3c7",2-s2.0-0033739491
"Torre C., Mattutino G.","7005464291;6506493063;",2000,"Journal of Forensic Sciences","https://www.scopus.com/inward/record.uri?eid=2-s2.0-0033937097&partnerID=40&md5=4812a7e3ebca39f6b0aaf291d316640c",2-s2.0-0033937097
"Charpentier B., Desrochers C.","21736308800;6601996936;",2000,"Journal of Forensic Sciences","https://www.scopus.com/inward/record.uri?eid=2-s2.0-0034021847&partnerID=40&md5=23186db8d5e672ca00303e4da9d4bb09",2-s2.0-0034021847
"Lebiedzik J., Johnson D.L.","6603130185;57197154064;",2000,"Journal of Forensic Sciences","https://www.scopus.com/inward/record.uri?eid=2-s2.0-0033986408&partnerID=40&md5=cc291ed01341a3d22b87f29cc0907ba7",2-s2.0-0033986408
"Garofano L., Capra M., Ferrari F., Bizzaro G.P., Di Tullio D., Dell'Olio M., Ghitti A.","13003629700;7006298574;36883328400;6507667796;6508260289;6603561438;6506793662;",1999,"Forensic Science International","https://www.scopus.com/inward/record.uri?eid=2-s2.0-0033038170&doi=10.1016%2fS0379-0738%2899%2900035-3&partnerID=40&md5=5895cfdc2c630a19689aadb1f2753da1",2-s2.0-0033038170
"Niewöhner L., Wenz H.W.","20135268700;7003936731;",1999,"Journal of Forensic Sciences","https://www.scopus.com/inward/record.uri?eid=2-s2.0-17644431530&partnerID=40&md5=be48e041b74059016885e4a86497303c",2-s2.0-17644431530
"Zeichner A., Schecter B., Brener R.","7005860122;6508313917;7004268632;",1998,"Journal of Forensic Sciences","https://www.scopus.com/inward/record.uri?eid=2-s2.0-0031861138&partnerID=40&md5=5b22f98dd5876a80ea118c5f7c474fb9",2-s2.0-0031861138
"MacCrehan W.A., Smith K.D., Rowe W.F.","7003651944;55568517702;24455160900;",1998,"Journal of Forensic Sciences","https://www.scopus.com/inward/record.uri?eid=2-s2.0-0031929716&partnerID=40&md5=93a31f31c84e13f1c354baf3e24fda0e",2-s2.0-0031929716
"Miyauchi H., Kumihashi M., Shibayama T.","16212821700;6506493455;57205895586;",1998,"Journal of Forensic Sciences","https://www.scopus.com/inward/record.uri?eid=2-s2.0-0031931445&partnerID=40&md5=81b1f2849b9ff94ecfdd54150aa47b5d",2-s2.0-0031931445
"Brettell T.A., Saferstein R.","6604035747;6603724137;",1997,"Analytical Chemistry","https://www.scopus.com/inward/record.uri?eid=2-s2.0-0030876033&partnerID=40&md5=8d820d5544f12c925b6e32119bef9a80",2-s2.0-0030876033
"Basu S., Boone Jr. C.E., Denio Jr. D.J., Miazga R.A.","7403656094;36797360700;7801377796;6505569890;",1997,"Journal of Forensic Sciences","https://www.scopus.com/inward/record.uri?eid=2-s2.0-0030742763&partnerID=40&md5=817da3eb2c9b9a21dc20bdf0aed0d50c",2-s2.0-0030742763
