Authors,Author(s) ID,Year,Source title,Link,EID
"Kuula J., Pölönen I., Puupponen H.-H., Selander T., Reinikainen T., Kalenius T., Saari H.","24363668200;55257235200;36158672800;57189086576;7004756057;55504955400;7003922988;",2012,"Proceedings of SPIE - The International Society for Optical Engineering","https://www.scopus.com/inward/record.uri?eid=2-s2.0-84870195850&doi=10.1117%2f12.918555&partnerID=40&md5=6f3c7934a514605b71da0a6516d9f70a",2-s2.0-84870195850
"Schumacher R., Barth M., Neimke D., Niewöhner L.","14630960900;57189351968;14631074000;20135268700;",2010,"Proceedings of SPIE - The International Society for Optical Engineering","https://www.scopus.com/inward/record.uri?eid=2-s2.0-77954526420&doi=10.1117%2f12.853852&partnerID=40&md5=6b44d1d669363e886e1558b0cc8ee5d0",2-s2.0-77954526420
"Hondrogiannis E., Andersen D., Miziolek A.W.","55342863000;37100917000;7003962186;",2013,"Proceedings of SPIE - The International Society for Optical Engineering","https://www.scopus.com/inward/record.uri?eid=2-s2.0-84881148483&doi=10.1117%2f12.2017900&partnerID=40&md5=69acbccbc96df591a4d9b295865c3f38",2-s2.0-84881148483
"Burnett B.R.","35564659500;",2014,"Proceedings of SPIE - The International Society for Optical Engineering","https://www.scopus.com/inward/record.uri?eid=2-s2.0-84922983230&doi=10.1117%2f12.2065553&partnerID=40&md5=f0014b023ebac5face68139d11f4d771",2-s2.0-84922983230
"Kotrlý M., Turková I.","56319424700;35086846200;",2011,"Proceedings of SPIE - The International Society for Optical Engineering","https://www.scopus.com/inward/record.uri?eid=2-s2.0-79960419864&doi=10.1117%2f12.887850&partnerID=40&md5=a3777354822dab6f731d3fa682f1ec84",2-s2.0-79960419864
"Cervelli F., Carrato S., Mattei A., Jerian M., Benevoli L., Mancini L., Zanini F., Vaccari L., Perucchi A., Aquilanti G.","23134567700;7004596594;9132584400;9132584000;36909359600;7103376845;57204189019;6602731172;6603071452;55913711400;",2011,"Proceedings of SPIE - The International Society for Optical Engineering","https://www.scopus.com/inward/record.uri?eid=2-s2.0-79952648611&doi=10.1117%2f12.876118&partnerID=40&md5=cf7265fc8fa49c639c393a9cefa3ee4a",2-s2.0-79952648611
"Biedermann A., Vuille J.","7004542967;35763022000;",2016,"Digital Investigation","https://www.scopus.com/inward/record.uri?eid=2-s2.0-84962382649&doi=10.1016%2fj.diin.2016.01.011&partnerID=40&md5=4fa530f21add4688ca422ea9b70ae921",2-s2.0-84962382649
"Knijnenberg A., Stamouli A., Janssen M.","15044809900;6602670587;56519154200;",2014,"Proceedings of SPIE - The International Society for Optical Engineering","https://www.scopus.com/inward/record.uri?eid=2-s2.0-84923066193&doi=10.1117%2f12.2066992&partnerID=40&md5=a56b8586b248492b1878fea1ee78eb31",2-s2.0-84923066193
"Ricci C., Kazarian S.G.","57191581925;7005510823;",2006,"Proceedings of SPIE - The International Society for Optical Engineering","https://www.scopus.com/inward/record.uri?eid=2-s2.0-33846974743&doi=10.1117%2f12.689429&partnerID=40&md5=cf8bf7592f3a9215cbab4270a1245dd5",2-s2.0-33846974743
"Janssen M., Stamouli A., Knijnenberg A.","56519154200;6602670587;15044809900;",2015,"Proceedings of SPIE - The International Society for Optical Engineering","https://www.scopus.com/inward/record.uri?eid=2-s2.0-84962651920&doi=10.1117%2f12.2197028&partnerID=40&md5=966aa31e02181aa557006ea23e592d80",2-s2.0-84962651920
"Toal S.J., Niemeyer W.D., Conte S., Montgomery D.D., Erikson G.S.","9434086100;7004458978;56519574900;56519132100;56520024100;",2014,"Proceedings of SPIE - The International Society for Optical Engineering","https://www.scopus.com/inward/record.uri?eid=2-s2.0-84923039907&doi=10.1117%2f12.2074212&partnerID=40&md5=9d2ae7b557de203ab609e0f7b1ce3b27",2-s2.0-84923039907
"Déliot P., Corcelle B., Achard V., Dartigalongue Th., Desmarais A., Giacometti C.","23060078700;56337885500;6603239438;6505910276;56337364000;56337700200;",2012,"Workshop on Hyperspectral Image and Signal Processing, Evolution in Remote Sensing","https://www.scopus.com/inward/record.uri?eid=2-s2.0-84906535629&doi=10.1109%2fWHISPERS.2012.6874252&partnerID=40&md5=7b38fae8ccf1280ef03a83ee2bfa0b34",2-s2.0-84906535629
"Wyatt J.M.","57197291589;",2011,"Proceedings of SPIE - The International Society for Optical Engineering","https://www.scopus.com/inward/record.uri?eid=2-s2.0-79960383833&doi=10.1117%2f12.883409&partnerID=40&md5=121d66c4e4ef7f88c636e7d641287f3c",2-s2.0-79960383833
"Meillier C., Achard V., Deliot P., Dartigalongue T., Desmarais A., Giacometti C.","56304090800;6603239438;23060078700;6505910276;56337364000;56337700200;",2017,"Workshop on Hyperspectral Image and Signal Processing, Evolution in Remote Sensing","https://www.scopus.com/inward/record.uri?eid=2-s2.0-85038570319&doi=10.1109%2fWHISPERS.2013.8080660&partnerID=40&md5=694549e62cc9d1845fdb1c74dca05658",2-s2.0-85038570319
"Biedermann A., Vuille J.","7004542967;35763022000;",2016,"DFRWS 2016 EU - Proceedings of the 3rd Annual DFRWS Europe","https://www.scopus.com/inward/record.uri?eid=2-s2.0-85068687729&doi=10.1016%2fj.diin.2016.01.011&partnerID=40&md5=e38e5259d8e2eacee1caaab540ede8b2",2-s2.0-85068687729
[No author name available],[No author id available],2014,"Proceedings of SPIE - The International Society for Optical Engineering","https://www.scopus.com/inward/record.uri?eid=2-s2.0-84923101345&partnerID=40&md5=c7809061b880d4625aad584090ad34c1",2-s2.0-84923101345
"Burnett B.R.","35564659500;",2014,"Proceedings of SPIE - The International Society for Optical Engineering","https://www.scopus.com/inward/record.uri?eid=2-s2.0-84923036080&doi=10.1117%2f12.2065556&partnerID=40&md5=d1eba3c1e534b25178170b4d6de2863e",2-s2.0-84923036080
"White T.R.","56519013900;",2014,"Proceedings of SPIE - The International Society for Optical Engineering","https://www.scopus.com/inward/record.uri?eid=2-s2.0-84923005418&doi=10.1117%2f12.2073770&partnerID=40&md5=4fae77be1bc88f425f172b732385a9cc",2-s2.0-84923005418
"Abdul Halim M.I., Safian M.F., Elias E., Shazali S.S.","41760958100;26533402000;55904054800;57197743726;",2013,"IEEE Symposium on Computers and Informatics, ISCI 2013","https://www.scopus.com/inward/record.uri?eid=2-s2.0-84886516979&doi=10.1109%2fISCI.2013.6612409&partnerID=40&md5=880f1cdbf7e7303cbdb7b2a0bfa84ecf",2-s2.0-84886516979
[No author name available],[No author id available],2011,"Proceedings of SPIE - The International Society for Optical Engineering","https://www.scopus.com/inward/record.uri?eid=2-s2.0-79960406197&partnerID=40&md5=61325d6f42c7596f66b9f57217a70dc6",2-s2.0-79960406197
"Trimpe M.A.","8273298800;",2011,"Proceedings of SPIE - The International Society for Optical Engineering","https://www.scopus.com/inward/record.uri?eid=2-s2.0-79960395558&doi=10.1117%2f12.887503&partnerID=40&md5=e1475a6c0f49694cb520df7376526c88",2-s2.0-79960395558
"Kotrlý M., Turková I.","56319424700;35086846200;",2010,"Proceedings of SPIE - The International Society for Optical Engineering","https://www.scopus.com/inward/record.uri?eid=2-s2.0-77954509570&doi=10.1117%2f12.853938&partnerID=40&md5=1e8d6c0467f91fc38332804e162e489f",2-s2.0-77954509570
"Schwoeble A.J., Strohmeier B.R., Piasecki J.D.","6507999564;6603730593;35086690100;",2010,"Proceedings of SPIE - The International Society for Optical Engineering","https://www.scopus.com/inward/record.uri?eid=2-s2.0-77954507849&doi=10.1117%2f12.863906&partnerID=40&md5=4fef78dae5ca24a14946dbde22bb788c",2-s2.0-77954507849
"Burnett B.R.","35564659500;",2009,"Proceedings of SPIE - The International Society for Optical Engineering","https://www.scopus.com/inward/record.uri?eid=2-s2.0-69949151311&doi=10.1117%2f12.827362&partnerID=40&md5=9cf8b0af23d20ac687ce9bb97a0edc62",2-s2.0-69949151311
"Charles S., Dehan D., Geusens N., Nys B.","57197281468;34869402300;34978537600;35080922200;",2009,"Proceedings of SPIE - The International Society for Optical Engineering","https://www.scopus.com/inward/record.uri?eid=2-s2.0-69949150909&doi=10.1117%2f12.827583&partnerID=40&md5=56892c608c03418bf58d587f79f73e92",2-s2.0-69949150909
"McKinney R.E.","7102726510;",1986,"Proceedings of SPIE - The International Society for Optical Engineering","https://www.scopus.com/inward/record.uri?eid=2-s2.0-0022897555&doi=10.1117%2f12.964439&partnerID=40&md5=6509173ee02c26bfaee87f1f4b5b23ea",2-s2.0-0022897555
"Rains T.C., Barnes I.L.","6603756791;57205917321;",1977,"Proceedings of SPIE - The International Society for Optical Engineering","https://www.scopus.com/inward/record.uri?eid=2-s2.0-84957476480&doi=10.1117%2f12.955477&partnerID=40&md5=a67d3b90dc1403565239ff0507811b87",2-s2.0-84957476480
